{
  "title": "DIMS reference study",
  "subtitle": "Synthetic signals with known answers",
  "videoIDs": [
    "reference"
  ],
  "dataTypes": {
    "reference": [
      "eff_hand_l",
      "eff_hand_r",
      "eff_other",
      "flat",
      "noise_a",
      "noise_b",
      "quantised",
      "sine",
      "sine_lagged"
    ]
  },
  "include_RQA": [
    "sine",
    "noise_a",
    "quantised",
    "flat"
  ],
  "include_cRQA": [
    [
      "sine",
      "sine_lagged"
    ]
  ],
  "include_crosswavelet": [
    [
      "sine",
      "sine_lagged"
    ],
    [
      "noise_a",
      "noise_b"
    ],
    [
      "eff_hand_l",
      "eff_hand_r"
    ],
    [
      "eff_hand_l",
      "eff_other"
    ],
    [
      "eff_hand_r",
      "eff_other"
    ]
  ],
  "include_network": true,
  "analysis": {
    "crosswavelet": {
      "mcCount": 20
    }
  },
  "defaultWindowSize": 5
}
